{
  "$schema": "https://json-schema.org/draft/2020-12/schema",
  "$id": "https://lectern.local/contracts/fantasy_grounds_snapshot_v1.schema.json",
  "title": "Lectern Fantasy Grounds Snapshot",
  "type": "object",
  "additionalProperties": false,
  "required": ["schema_version", "sequence", "generated_at", "source", "catalog", "characters", "encounters", "combat"],
  "properties": {
    "schema_version": { "const": 1 },
    "sequence": { "type": "integer", "minimum": 1 },
    "generated_at": { "type": "string", "format": "date-time" },
    "source": { "$ref": "#/$defs/source" },
    "catalog": { "$ref": "#/$defs/catalog" },
    "characters": { "type": "array", "items": { "$ref": "#/$defs/record" } },
    "encounters": { "type": "array", "items": { "$ref": "#/$defs/encounter" } },
    "combat": { "$ref": "#/$defs/combat" },
    "events": { "type": "array", "items": { "$ref": "#/$defs/event" } }
  },
  "$defs": {
    "source": {
      "type": "object",
      "additionalProperties": false,
      "required": ["provider", "extension_version", "ruleset", "campaign_key", "campaign_name", "modules"],
      "properties": {
        "provider": { "const": "fantasy_grounds" },
        "extension_version": { "type": "string", "minLength": 1 },
        "ruleset": { "const": "5E" },
        "campaign_key": { "type": "string", "minLength": 1 },
        "campaign_name": { "type": "string", "minLength": 1 },
        "modules": { "type": "array", "items": { "type": "string" }, "uniqueItems": true }
      }
    },
    "catalog": {
      "type": "object",
      "additionalProperties": false,
      "required": ["classes", "subclasses", "species", "feats", "backgrounds"],
      "properties": {
        "classes": { "$ref": "#/$defs/record_list" },
        "subclasses": { "$ref": "#/$defs/record_list" },
        "species": { "$ref": "#/$defs/record_list" },
        "feats": { "$ref": "#/$defs/record_list" },
        "backgrounds": { "$ref": "#/$defs/record_list" }
      }
    },
    "record_list": {
      "type": "array",
      "items": { "$ref": "#/$defs/record" }
    },
    "record": {
      "type": "object",
      "additionalProperties": false,
      "required": ["source_key", "record_type", "name", "source_path", "module_name", "fields", "raw"],
      "properties": {
        "source_key": { "type": "string", "minLength": 1 },
        "record_type": { "type": "string", "minLength": 1 },
        "name": { "type": "string", "minLength": 1 },
        "source_path": { "type": "string", "minLength": 1 },
        "module_name": { "type": ["string", "null"] },
        "fields": { "type": "object" },
        "raw": { "type": "object" }
      }
    },
    "encounter": {
      "type": "object",
      "additionalProperties": false,
      "required": ["source_key", "record_type", "name", "source_path", "module_name", "fields", "raw", "participants"],
      "properties": {
        "source_key": { "type": "string", "minLength": 1 },
        "record_type": { "const": "encounter" },
        "name": { "type": "string", "minLength": 1 },
        "source_path": { "type": "string", "minLength": 1 },
        "module_name": { "type": ["string", "null"] },
        "fields": { "type": "object" },
        "raw": { "type": "object" },
        "participants": {
          "type": "array",
          "items": {
            "type": "object",
            "additionalProperties": false,
            "required": ["source_key", "name", "quantity"],
            "properties": {
              "source_key": { "type": "string", "minLength": 1 },
              "name": { "type": "string", "minLength": 1 },
              "quantity": { "type": "integer", "minimum": 1 },
              "armor_class": { "type": ["integer", "null"] },
              "hit_points": { "type": ["integer", "null"] },
              "initiative_mod": { "type": ["integer", "null"] },
              "raw": { "type": ["object", "null"] }
            }
          }
        }
      }
    },
    "combat": {
      "type": "object",
      "additionalProperties": false,
      "required": ["active", "round", "active_source_key", "combatants"],
      "properties": {
        "active": { "type": "boolean" },
        "round": { "type": "integer", "minimum": 0 },
        "active_source_key": { "type": ["string", "null"] },
        "combatants": { "type": "array", "items": { "$ref": "#/$defs/combatant" } },
        "session_key": { "type": ["string", "null"] },
        "session_name": { "type": ["string", "null"] },
        "session_state": { "type": "string", "enum": ["inactive", "open", "closed"] },
        "started_at": { "type": ["string", "null"], "format": "date-time" },
        "outcome": { "type": ["string", "null"], "enum": ["victory", "defeat", "retreat", "unresolved", null] },
        "completed_at": { "type": ["string", "null"], "format": "date-time" }
      }
    },
    "combatant": {
      "type": "object",
      "additionalProperties": false,
      "required": ["source_key", "name", "order", "initiative", "armor_class", "hit_points", "effects", "raw"],
      "properties": {
        "source_key": { "type": "string", "minLength": 1 },
        "name": { "type": "string", "minLength": 1 },
        "order": { "type": "integer", "minimum": 0 },
        "initiative": { "type": ["number", "null"] },
        "armor_class": { "type": ["integer", "null"] },
        "hit_points": {
          "type": "object",
          "additionalProperties": false,
          "required": ["maximum", "current", "temporary", "wounds"],
          "properties": {
            "maximum": { "type": ["integer", "null"] },
            "current": { "type": ["integer", "null"] },
            "temporary": { "type": ["integer", "null"] },
            "wounds": { "type": ["integer", "null"] }
          }
        },
        "effects": { "type": "array", "items": { "type": "object" } },
        "raw": { "type": "object" }
      }
    },
    "event_participant": {
      "type": ["object", "null"],
      "additionalProperties": false,
      "required": ["source_key", "name"],
      "properties": {
        "source_key": { "type": ["string", "null"] },
        "name": { "type": "string", "minLength": 1 }
      }
    },
    "event": {
      "type": "object",
      "additionalProperties": false,
      "required": ["event_id", "sequence", "timestamp", "round", "encounter_source_key", "type", "actor", "target", "amount", "description", "metadata"],
      "properties": {
        "event_id": { "type": "string", "minLength": 1 },
        "sequence": { "type": "integer", "minimum": 1 },
        "timestamp": { "type": "string", "format": "date-time" },
        "round": { "type": "integer", "minimum": 0 },
        "encounter_source_key": { "type": "string", "minLength": 1 },
        "type": { "enum": ["action", "attack", "damage", "effect", "healing", "outcome", "save", "spell", "turn_end", "turn_start"] },
        "actor": { "$ref": "#/$defs/event_participant" },
        "target": { "$ref": "#/$defs/event_participant" },
        "amount": { "type": ["integer", "null"] },
        "description": { "type": "string" },
        "metadata": {
          "type": "object",
          "properties": {
            "damage_types": {
              "type": "array",
              "items": { "type": "string", "minLength": 1 },
              "uniqueItems": true
            },
            "damage_components": {
              "type": "array",
              "items": {
                "type": "object",
                "required": ["types", "rolled", "applied"],
                "properties": {
                  "types": { "type": "array", "items": { "type": "string", "minLength": 1 }, "uniqueItems": true },
                  "rolled": { "type": ["number", "null"] },
                  "applied": { "type": ["number", "null"] },
                  "resisted": { "type": "number" },
                  "vulnerable": { "type": "number" }
                }
              }
            },
            "damage_contributors": {
              "type": "array",
              "items": {
                "type": "object",
                "required": ["name", "effect_key", "effect_label", "effect_component", "dice", "modifier", "damage_types"],
                "properties": {
                  "name": { "type": "string", "minLength": 1 },
                  "effect_key": { "type": ["string", "null"] },
                  "effect_label": { "type": "string" },
                  "effect_component": { "type": "string" },
                  "dice": { "type": "string" },
                  "modifier": { "type": "number" },
                  "damage_types": {
                    "type": "array",
                    "items": { "type": "string", "minLength": 1 },
                    "uniqueItems": true
                  }
                }
              }
            },
            "damage_resolution": { "enum": ["authoritative", "description"] },
            "post_mitigation_damage": { "type": "number", "minimum": 0 },
            "mitigated_damage": { "type": "number", "minimum": 0 },
            "vulnerability_bonus": { "type": "number", "minimum": 0 },
            "temporary_hp_absorbed": { "type": "number", "minimum": 0 },
            "overkill": { "type": "number", "minimum": 0 },
            "originating_action": { "type": "string", "minLength": 1 },
            "save_ability": {
              "enum": ["strength", "dexterity", "constitution", "intelligence", "wisdom", "charisma"]
            },
            "save_dc": { "type": "number" },
            "save_total": { "type": "number" },
            "save_resolution": {
              "enum": ["success", "failure", "half_success", "half_failure", "none"]
            },
            "healing_kind": { "enum": ["dice", "fixed"] },
            "healing_resolution": { "enum": ["authoritative"] },
            "lifecycle": {
              "enum": [
                "encounter_start",
                "encounter_end",
                "effect_added",
                "effect_removed"
              ]
            },
            "effect_name": { "type": "string", "minLength": 1 },
            "effect_key": { "type": ["string", "null"] },
            "effect_state": { "enum": ["added", "removed"] },
            "duration": { "type": "number" },
            "apply": { "type": ["string", "null"] },
            "is_active": { "type": "boolean" },
            "source_name": { "type": ["string", "null"] },
            "source_reference": { "type": ["string", "null"] },
            "source_attribution": {
              "enum": [
                "effect_source_reference",
                "effect_source_name",
                "active_self",
                "unattributed"
              ]
            }
          }
        }
      }
    }
  }
}
