{
  "schema_version": 1,
  "sequence": 1,
  "generated_at": "2026-07-17T20:15:31Z",
  "source": {
    "provider": "fantasy_grounds",
    "extension_version": "1.0.0",
    "ruleset": "5E",
    "campaign_key": "lectern-test-campaign",
    "campaign_name": "Lectern Test Campaign",
    "modules": ["Sanitized Test Content"]
  },
  "catalog": {
    "classes": [
      {
        "source_key": "5E:class:test-fighter",
        "record_type": "class",
        "name": "Test Fighter",
        "source_path": "reference.classes.testfighter@Sanitized Test Content",
        "module_name": "Sanitized Test Content",
        "fields": { "hit_die": 10 },
        "raw": {}
      }
    ],
    "subclasses": [
      {
        "source_key": "5E:subclass:test-champion",
        "record_type": "subclass",
        "name": "Test Champion",
        "source_path": "reference.subclassdata.testchampion@Sanitized Test Content",
        "module_name": "Sanitized Test Content",
        "fields": { "description": "A sanitized subclass fixture." },
        "raw": {}
      }
    ],
    "species": [
      {
        "source_key": "5E:species:test-human",
        "record_type": "species",
        "name": "Test Human",
        "source_path": "reference.racedata.testhuman@Sanitized Test Content",
        "module_name": "Sanitized Test Content",
        "fields": { "description": "A sanitized species fixture." },
        "raw": {}
      }
    ],
    "feats": [
      {
        "source_key": "5E:feat:test-alert",
        "record_type": "feat",
        "name": "Test Alert",
        "source_path": "reference.featdata.testalert@Sanitized Test Content",
        "module_name": "Sanitized Test Content",
        "fields": { "description": "A sanitized feat fixture." },
        "raw": {}
      }
    ],
    "backgrounds": [
      {
        "source_key": "5E:background:test-soldier",
        "record_type": "background",
        "name": "Test Soldier",
        "source_path": "reference.backgrounddata.testsoldier@Sanitized Test Content",
        "module_name": "Sanitized Test Content",
        "fields": { "description": "A sanitized background fixture." },
        "raw": {}
      }
    ]
  },
  "characters": [
    {
      "source_key": "5E:character:test-hero",
      "record_type": "character",
      "name": "Fantasy Grounds Test Hero",
      "source_path": "charsheet.id-00001",
      "module_name": null,
      "fields": {
        "player_name": "Test Player",
        "species": "Test Human",
        "class_name": "Test Fighter",
        "subclass": "Test Champion",
        "background": "Test Soldier",
        "level": 5,
        "armor_class": 17,
        "max_hp": 44,
        "current_hp": 37,
        "initiative_mod": 2,
        "abilities": { "str": 16, "dex": 14, "con": 14, "int": 10, "wis": 12, "cha": 8 },
        "feats": "Test Alert",
        "equipped_weapon": "Greatsword; Javelin",
        "equipped_armor": "Chain Mail"
      },
      "raw": {}
    }
  ],
  "encounters": [
    {
      "source_key": "5E:battle:test-encounter",
      "record_type": "encounter",
      "name": "Test Encounter",
      "source_path": "battle.id-00001",
      "module_name": null,
      "fields": {},
      "raw": {},
      "participants": [
        { "source_key": "5E:npc:test-creature", "name": "Test Creature", "quantity": 2, "armor_class": 13, "hit_points": 12, "initiative_mod": 2, "raw": {} }
      ]
    }
  ],
  "combat": {
    "active": true,
    "round": 1,
    "session_key": "test-session-001",
    "outcome": null,
    "completed_at": null,
    "active_source_key": "5E:ct:id-00001",
    "combatants": [
      {
        "source_key": "5E:ct:id-00001",
        "name": "Test Creature",
        "order": 0,
        "initiative": 14,
        "armor_class": 13,
        "hit_points": { "maximum": 12, "current": 9, "temporary": 0, "wounds": 3 },
        "effects": [{
          "effect_key": "combattracker.list.id-00001.effects.id-00001",
          "name": "Tested",
          "duration": 2,
          "source_name": "Fantasy Grounds Test Hero",
          "source_reference": "combattracker.list.id-00002",
          "is_active": true,
          "apply": ""
        }],
        "raw": {}
      }
    ]
  },
  "events": [
    {
      "event_id": "test-session-001:1",
      "sequence": 1,
      "timestamp": "2026-07-17T20:00:01Z",
      "round": 1,
      "encounter_source_key": "test-session-001",
      "type": "attack",
      "actor": { "source_key": "5E:character:test-hero", "name": "Fantasy Grounds Test Hero" },
      "target": { "source_key": "5E:ct:id-00001", "name": "Test Creature" },
      "amount": null,
      "description": "Longsword attack: 18",
        "metadata": { "action_name": "Longsword", "roll_type": "attack", "raw_roll": 13, "modifier": 5, "roll_total": 18, "target_ac": 13, "natural_roll": 13, "result": "Hit", "authoritative_result": true }
    },
    {
      "event_id": "test-session-001:2",
      "sequence": 2,
      "timestamp": "2026-07-17T20:00:03Z",
      "round": 1,
      "encounter_source_key": "test-session-001",
      "type": "damage",
        "actor": { "source_key": "5E:character:test-hero", "name": "Fantasy Grounds Test Hero" },
      "target": { "source_key": "5E:ct:id-00001", "name": "Test Creature" },
      "amount": 3,
      "description": "Wounds increased from 0 to 3",
        "metadata": { "action_name": "Longsword", "raw_roll": 1, "modifier": 2, "roll_total": 3, "target_ac": 13, "adjustment": 0, "attribution": "matched_recent_roll", "previous_wounds": 0, "current_wounds": 3, "current_hp": 9, "maximum_hp": 12, "damage_types": ["slashing"], "damage_components": [{ "types": ["slashing"], "rolled": 3, "applied": 3, "resisted": 0, "vulnerable": 0 }], "damage_resolution": "authoritative" }
    }
  ]
}
